{
  "slug": "email-lifecycle-send-check",
  "category": "capabilities",
  "tier": "atom",
  "version": "0.1.1",
  "playbook": "email-lifecycle",
  "tags": [
    "content",
    "outreach"
  ],
  "standalone": true,
  "requires_skills": [
    "ad-policy-check",
    "claims-gate",
    "email-lifecycle",
    "marketing-data-access",
    "marketing-guide",
    "run-memory",
    "save-learning",
    "save-to-brain",
    "spend-gate",
    "write-report"
  ]
}
