{
  "slug": "make-static-ads-graphic-request",
  "category": "capabilities",
  "tier": "atom",
  "version": "0.9.1",
  "playbook": "make-static-ads",
  "tags": [
    "ads",
    "design"
  ],
  "standalone": true,
  "requires_skills": [
    "ad-policy-check",
    "claims-gate",
    "honest-review",
    "make-static-ads",
    "make-static-ads-ad-copy",
    "make-static-ads-claims-extract",
    "make-static-ads-compose",
    "make-static-ads-render-review",
    "marketing-data-access",
    "marketing-guide",
    "run-memory",
    "save-learning",
    "save-to-brain",
    "spend-gate",
    "write-report"
  ]
}
