{
  "slug": "work-with-creators-brief-writer",
  "category": "capabilities",
  "tier": "atom",
  "version": "0.1.1",
  "playbook": "work-with-creators",
  "tags": [
    "social",
    "outreach"
  ],
  "standalone": true,
  "requires_skills": [
    "ad-policy-check",
    "claims-gate",
    "marketing-data-access",
    "marketing-guide",
    "run-memory",
    "save-learning",
    "save-to-brain",
    "spend-gate",
    "work-with-creators",
    "write-report"
  ]
}
