{
  "slug": "research-audience-score-segment-qa",
  "category": "capabilities",
  "tier": "atom",
  "version": "0.1.1",
  "playbook": "research-audience",
  "tags": [
    "research",
    "lead-generation"
  ],
  "standalone": false,
  "requires_skills": [
    "claims-gate",
    "marketing-data-access",
    "marketing-guide",
    "run-memory",
    "save-learning",
    "save-to-brain",
    "spend-gate",
    "write-report"
  ]
}
