{
  "slug": "spend-gate",
  "category": "capabilities",
  "tier": "atom",
  "version": "0.1.2",
  "used_by": [
    "analyze-performance",
    "email-lifecycle",
    "improve-search-visibility",
    "make-content",
    "make-static-ads",
    "plan-campaign",
    "research-audience",
    "research-competitors",
    "research-market",
    "run-organic-social",
    "run-paid-campaigns",
    "where-to-start",
    "work-with-creators",
    "write-outreach"
  ],
  "tags": [
    "research-tools"
  ],
  "standalone": false,
  "requires_skills": [
    "claims-gate",
    "marketing-data-access",
    "marketing-guide",
    "run-memory",
    "save-learning",
    "save-to-brain",
    "write-report"
  ]
}
